Kode Pusat,nama_rumah_sakit,jenis_rumah_sakit,Alamat,kelurahan,Kecamatan,Telepon,query,location,Lat,Lon
3272072,Bhayangkara Tk.I  R. Said Sukanto,Rumah Sakit Umum,Jl. RS Polri,Kramat Jati,Kramat Jati,021 8093288,Kramat Jati Kramat Jati,"Kramat Jati, Jakarta Timur, Daerah Khusus Ibukota Jakarta, 13640, Indonesia",-6.2728548,106.8701892
3172094,Universitas Kristen Indonesia,Rumah Sakit Umum,Jl. Mayjen Sutoyo No. 2,Cawang,Makasar,"021 8092317, 021 8092831, 021 8010523",Cawang Makasar,"Cawang, Simpang Susun Cawang, RW 06, Kebon Pala, Makasar, Jakarta Timur, Daerah Khusus Ibukota Jakarta, 13340, Indonesia",-6.2434238,106.877256
3172520,Harum Sisma Medika,Rumah Sakit Umum,Jl. Tarum Barat - Kalimalang,Cipinang Melayu,Makasar,"021 8617212, 021 8617213",Cipinang Melayu Makasar,"Cipinang Melayu, Makasar, Jakarta Timur, Daerah Khusus Ibukota Jakarta, Indonesia",-6.2483449,106.9037747
3172724,Haji Jakarta,Rumah Sakit Umum,Jl. Raya Pondok Gede No. 4,Pinang Ranti,Makasar,"021 8000693, 021 8000695",Pinang Ranti Makasar,"Pinang Ranti, Makasar, Jakarta Timur, Daerah Khusus Ibukota Jakarta, Indonesia",-6.2884275,106.8833312
3172126,Pasar Rebo,Rumah Sakit Umum Daerah,Jl. Letjen T. B. Simatupang No. 30,Gedong,Pasar Rebo,"021 8401127, 021 8400109",Gedong Pasar Rebo,"Gedong, Pasar Rebo, Jakarta Timur, Daerah Khusus Ibukota Jakarta, 13760, Indonesia",-6.3035401,106.8611734
3172495,Omni Internasional Pulomas,Rumah Sakit Umum,Jl. Pulomas Barat VI No. 20,Kayu Putih,Pulogadung,"021 4723332, 021 4722719",Kayu Putih Pulogadung,"SD Negeri Pulogadung 09 Pagi dan 10 Petang, Jalan Kayu Putih I, RW 08, Pulo Gadung, Jakarta Timur, Daerah Khusus Ibukota Jakarta, 13260, Indonesia",-6.18135105,106.89575674789054
3172516,Kartika Pulomas ,Rumah Sakit Umum,Jl. Pulomas Timur K. No.2,Kayu Putih,Pulogadung,"021 4723402, 021 4703333",Kayu Putih Pulogadung,"SD Negeri Pulogadung 09 Pagi dan 10 Petang, Jalan Kayu Putih I, RW 08, Pulo Gadung, Jakarta Timur, Daerah Khusus Ibukota Jakarta, 13260, Indonesia",-6.18135105,106.89575674789054
3172713,Mediros,Rumah Sakit Umum,Jl. Perintis Kemerdekaan Kav. 149,Pulogadung,Pulogadung,"021 4721238, 021 4721239",Pulogadung Pulogadung,"PT. JIEP Kawasan Industri Pulogadung, Cakung, Jakarta Timur, Daerah Khusus Ibukota Jakarta, Indonesia",-6.194789699999999,106.91108473112958
3172702,Dharma Nugraha,Rumah Sakit Umum,Jl. Balai Pustaka Baru No. 19,Rawamangun,Pulogadung,"021 4707433, 021 4707437",Rawamangun Pulogadung,"Gelanggang Remaja Kecamatan Pulogadung, Jalan Kayu Jati V, RW 05, Rawamangun, Pulo Gadung, Jakarta Timur, Daerah Khusus Ibukota Jakarta, 13250, Indonesia",-6.1927709,106.88673089912254
1000026,Resti Mulya,Rumah Sakit Ibu dan Anak,Jl. Pahlawan Komarudin Raya No. 5,Penggilingan,Cakung,021 4802192,Penggilingan Cakung,"Penggilingan, Cakung, Jakarta Timur, Daerah Khusus Ibukota Jakarta, 13940, Indonesia",-6.2050399,106.9359199
1000027,Duren Sawit,Rumah Sakit Khusus Jiwa,Jl. Duren Sawit Baru No. 2,Duren Sawit,Duren Sawit,"021 8628686, 021 8617601",Duren Sawit Duren Sawit,"Duren Sawit, Jakarta Timur, Daerah Khusus Ibukota Jakarta, Indonesia",-6.235992,106.9166626
3172735,Islam Klender Jakarta,Rumah Sakit Khusus Jiwa,Jl. Bunga Rampai X - Perumnas Klender,Malaka Jaya,Duren Sawit,"021 86602402, 021 8622491",Malaka Jaya Duren Sawit,"Malaka Jaya, Duren Sawit, Jakarta Timur, Daerah Khusus Ibukota Jakarta, 13460, Indonesia",-6.223973,106.9362377
1000030,SamMarie Basra,Rumah Sakit Ibu dan Anak,Jl. Basuki Rachmat  No. 31,Pondok Bambu,Duren Sawit,"021 86613145, 021 86613146",Pondok Bambu Duren Sawit,"Pondok Bambu, Duren Sawit, Jakarta Timur, Daerah Khusus Ibukota Jakarta, 13430, Indonesia",-6.2379668,106.9026733
3172137,Sayyidah,Rumah Sakit Ibu dan Anak,Jl. Taman Malaka Selatan No. 6,Pondok Kelapa,Duren Sawit,"021 86902950, 021 8655179",Pondok Kelapa Duren Sawit,"Pondok Kelapa, Duren Sawit, Jakarta Timur, Daerah Khusus Ibukota Jakarta, Indonesia",-6.2422972,106.9333134
3172243,Hermina Jatinegara,Rumah Sakit Ibu dan Anak,Jl. Jatinegara Barat No. 126 ,Kampung Melayu,Jatinegara,021 8196157,Kampung Melayu Jatinegara,"Kampung Melayu, Jatinegara, Jakarta Timur, Daerah Khusus Ibukota Jakarta, 13320, Indonesia",-6.2193557,106.8636187
1000031,Asta Nugraha,Rumah Sakit Bersalin,JL. Duren Sawit Raya Blok K.3 No.1,Klender,Duren Sawit,021 8615937,Klender Duren Sawit,"Klender, Jalan I Gusti Ngurah Rai, RW 02, Klender, Duren Sawit, Jakarta Timur, Daerah Khusus Ibukota Jakarta, 13470, Indonesia",-6.2132687,106.8993934
3172666,Restu ,Rumah Sakit Ibu dan Anak,Jl. Raya Bogor  Km. 19  No. 3.a,Kramat Jati,Kramat Jati,021 8001177,Kramat Jati Kramat Jati,"Kramat Jati, Jakarta Timur, Daerah Khusus Ibukota Jakarta, 13640, Indonesia",-6.2728548,106.8701892
1000032,Bina Waluya,Rumah Sakit Khusus Jantung,Jl. TB Simatupang No. 71 Jak-Tim,Gedong,Pasar Rebo,021 87781605,Gedong Pasar Rebo,"Gedong, Pasar Rebo, Jakarta Timur, Daerah Khusus Ibukota Jakarta, 13760, Indonesia",-6.3035401,106.8611734
3172301,Rawamangun,Rumah Sakit Khusus Bedah,Jl. Balai Pustaka Raya No. 29-31,Rawamangun,Pulogadung,021 4893531,Rawamangun Pulogadung,"Gelanggang Remaja Kecamatan Pulogadung, Jalan Kayu Jati V, RW 05, Rawamangun, Pulo Gadung, Jakarta Timur, Daerah Khusus Ibukota Jakarta, 13250, Indonesia",-6.1927709,106.88673089912254
1000034,Alvernia Agusta,Rumah Sakit Bersalin,Jl. Pemuda No. 80  RT.001 RW.08,Jati,Pulogadung,"021 4705266, 021 4720893",Jati Pulogadung,"Gelanggang Remaja Kecamatan Pulogadung, Jalan Kayu Jati V, RW 05, Rawamangun, Pulo Gadung, Jakarta Timur, Daerah Khusus Ibukota Jakarta, 13250, Indonesia",-6.1927709,106.88673089912254
